{
  "adjudication_id": "source_quorum_adjudication_1110410",
  "project_id": "1110410",
  "policy_version": "source_guard_policy_v2_autonomous_eval",
  "status": "AGENT_QUORUM_APPROVED_EVAL",
  "items": [
    {
      "decision_id": "SGD-B6FB5F61E3C292",
      "file_id": "SRC-ALL-PROJECTS-FILE-1A4EDEDD389D",
      "file_sha256": "70F74180BBB78AD1DBE529D70807F193102F26B8EB87F90B8477DD6190B0D792",
      "worksheet_name": "",
      "worksheet_fingerprint": "",
      "final_state": "PARSER_REQUIRED",
      "reason_codes": [
        "HUMAN_REVIEW_REQUIRED",
        "LEGACY_XLS_PARSER_REQUIRED",
        "MISSING_WORKSHEET_FINGERPRINT",
        "WORKSHEET_NOT_VISIBLE"
      ],
      "review_votes": {
        "source_role_classifier": "DENY",
        "project_identity_reviewer": "DENY",
        "workbook_forensics_reviewer": "QUARANTINE",
        "leakage_red_team": "DENY"
      },
      "unresolved_issues": []
    },
    {
      "decision_id": "SGD-F3A5C9E7B2674E",
      "file_id": "SRC-ALL-PROJECTS-FILE-98B23212FC59",
      "file_sha256": "B181DF645BA478C1446A7ADD9E3542E3FCCC49D877F4753073EE78611919DF04",
      "worksheet_name": "標單總表",
      "worksheet_fingerprint": "EACD28A726F59056114ED8FFCA09DE3FB4FF55D246869101666815292F21450F",
      "final_state": "AGENT_QUORUM_APPROVED_EVAL",
      "reason_codes": [
        "HASH_AND_WORKSHEET_FINGERPRINT_PRESENT",
        "INSUFFICIENT_IDENTITY",
        "NO_CROSS_PROJECT_OR_STALE_SIGNAL",
        "NO_REFERENCE_LEAKAGE_SIGNAL_IN_ALLOWED_METADATA",
        "PERMITTED_CURRENT_PROJECT_INPUT_ROLE",
        "PREFILTER_SUBMIT_TO_REVIEW",
        "PROJECT_IDENTITY_SUPPORTED_BY_MANIFEST_PATH",
        "VISIBLE_WORKSHEET",
        "WORKBOOK_FORENSICS_PASS"
      ],
      "review_votes": {
        "source_role_classifier": "ALLOW_EVAL",
        "project_identity_reviewer": "ALLOW_EVAL",
        "workbook_forensics_reviewer": "ALLOW_EVAL",
        "leakage_red_team": "ALLOW_EVAL"
      },
      "unresolved_issues": []
    },
    {
      "decision_id": "SGD-E25373215632FB",
      "file_id": "SRC-ALL-PROJECTS-FILE-98B23212FC59",
      "file_sha256": "B181DF645BA478C1446A7ADD9E3542E3FCCC49D877F4753073EE78611919DF04",
      "worksheet_name": "標單詳細表",
      "worksheet_fingerprint": "DD692A2C465B9BDACE117F4F78CE313EC69A2A26DDFCA7D2C06BF98DD3202B9E",
      "final_state": "AGENT_QUORUM_APPROVED_EVAL",
      "reason_codes": [
        "HASH_AND_WORKSHEET_FINGERPRINT_PRESENT",
        "INSUFFICIENT_IDENTITY",
        "NO_CROSS_PROJECT_OR_STALE_SIGNAL",
        "NO_REFERENCE_LEAKAGE_SIGNAL_IN_ALLOWED_METADATA",
        "PERMITTED_CURRENT_PROJECT_INPUT_ROLE",
        "PREFILTER_SUBMIT_TO_REVIEW",
        "PROJECT_IDENTITY_SUPPORTED_BY_MANIFEST_PATH",
        "VISIBLE_WORKSHEET",
        "WORKBOOK_FORENSICS_PASS"
      ],
      "review_votes": {
        "source_role_classifier": "ALLOW_EVAL",
        "project_identity_reviewer": "ALLOW_EVAL",
        "workbook_forensics_reviewer": "ALLOW_EVAL",
        "leakage_red_team": "ALLOW_EVAL"
      },
      "unresolved_issues": []
    },
    {
      "decision_id": "SGD-89E1E5092FF4EC",
      "file_id": "SRC-ALL-PROJECTS-FILE-98B23212FC59",
      "file_sha256": "B181DF645BA478C1446A7ADD9E3542E3FCCC49D877F4753073EE78611919DF04",
      "worksheet_name": "標單單價分析表",
      "worksheet_fingerprint": "8D961332042D9E97EA964E12ED2127C2926B9B28CD9B03854121FE029B144A58",
      "final_state": "AGENT_QUORUM_APPROVED_EVAL",
      "reason_codes": [
        "HASH_AND_WORKSHEET_FINGERPRINT_PRESENT",
        "INSUFFICIENT_IDENTITY",
        "NO_CROSS_PROJECT_OR_STALE_SIGNAL",
        "NO_REFERENCE_LEAKAGE_SIGNAL_IN_ALLOWED_METADATA",
        "PERMITTED_CURRENT_PROJECT_INPUT_ROLE",
        "PREFILTER_SUBMIT_TO_REVIEW",
        "PROJECT_IDENTITY_SUPPORTED_BY_MANIFEST_PATH",
        "VISIBLE_WORKSHEET",
        "WORKBOOK_FORENSICS_PASS"
      ],
      "review_votes": {
        "source_role_classifier": "ALLOW_EVAL",
        "project_identity_reviewer": "ALLOW_EVAL",
        "workbook_forensics_reviewer": "ALLOW_EVAL",
        "leakage_red_team": "ALLOW_EVAL"
      },
      "unresolved_issues": []
    }
  ],
  "summary": {
    "PARSER_REQUIRED": 1,
    "AGENT_QUORUM_APPROVED_EVAL": 3
  },
  "run_metadata": {
    "prefilter": "manifests\\source_guard\\project_manifests\\1110410\\deterministic_prefilter.json",
    "review_root": "manifests\\source_guard\\reviews\\batch-001",
    "created_at": "2026-06-22T11:11:33Z"
  }
}
